{
  "schema_version": 1,
  "unit": "replay-B-Alpha",
  "phase": "rework",
  "created_at": "2026-09-11T23:39:56.360335+00:00",
  "turn_count": 14,
  "tool_calls": 8,
  "tokens": {
    "input_tokens": 26,
    "cache_creation_input_tokens": 78179,
    "cache_read_input_tokens": 254063,
    "output_tokens": 15011,
    "thinking_tokens": 4696
  },
  "tool_metrics": {
    "raw_result_bytes": 47168,
    "delivered_result_bytes": 47168,
    "tool_delivery_ratio": 1.0
  },
  "retrieval_amplification": 1.0,
  "observed_reads": [
    {
      "path": "_tl-orc/project/evidence/benchmark-inputs/checkpoint-B/manifest.json",
      "selector": "full_file",
      "bytes": 1004,
      "digest": "aba1131d9f60bda309e337c29b6a6a1dab23b9f541b59c597c37327d06f1457c",
      "reason": "Tool execution: Read"
    },
    {
      "path": "_tl-orc/project/evidence/benchmark-inputs/checkpoint-B/resume.json",
      "selector": "full_file",
      "bytes": 3139,
      "digest": "a1f2b1ab079f6bb4873ee893c6101eeaf93740a94e0b89ca7146b9c5d2cd6ce8",
      "reason": "Tool execution: Read"
    },
    {
      "path": "_tl-orc/project/evidence/benchmark-inputs/checkpoint-B/CODE_TREE_STATUS.txt",
      "selector": "full_file",
      "bytes": 77,
      "digest": "8e83e4a3e038d2d37d2494bd1e0e1296950212dc7c87740fc7e3a368d30ce82c",
      "reason": "Tool execution: Read"
    },
    {
      "path": "_tl-orc/project/evidence/benchmark-inputs/checkpoint-B/PROJECT.md",
      "selector": "full_file",
      "bytes": 22852,
      "digest": "b189f6d233bb42de1420ea5dbb5cfd9b17cc71e6e0738d25e7b82da0ffc70a1e",
      "reason": "Tool execution: Read"
    },
    {
      "path": "_tl-orc/project/evidence/benchmark-inputs/checkpoint-B/spec-6-0a.md",
      "selector": "full_file",
      "bytes": 3237,
      "digest": "cf800ff2fd89ef3abaa74996334199005469f94b6b1657e21703c207fcebe913",
      "reason": "Tool execution: Read"
    },
    {
      "path": "_tl-orc/project/evidence/benchmark-inputs/checkpoint-B/dev-report-6-0a.md",
      "selector": "full_file",
      "bytes": 5203,
      "digest": "74c332479466bdcbfd5ef7cef3122927d93760c2db9571ebf1ebc618282de046",
      "reason": "Tool execution: Read"
    },
    {
      "path": "_tl-orc/project/evidence/benchmark-inputs/checkpoint-B/checker-6-0a-r1.md",
      "selector": "full_file",
      "bytes": 10267,
      "digest": "c337c3e217fcdd9ef036f2c82b793f81b6550603d9a63150d3300f5f2b517bad",
      "reason": "Tool execution: Read"
    }
  ],
  "failed_read_attempts": [],
  "reads_outside_allowed_set": [],
  "disallowed_external_attempts": [],
  "allowed_set": {
    "reference": "<repo-root>/_tl-orc/project/evidence/T015-r02/allowed_sets/allowed_set_checkpoint-B.json",
    "inputs": [
      "_tl-orc/project/evidence/benchmark-inputs/checkpoint-B/CODE_TREE_STATUS.txt",
      "_tl-orc/project/evidence/benchmark-inputs/checkpoint-B/PROJECT.md",
      "_tl-orc/project/evidence/benchmark-inputs/checkpoint-B/checker-6-0a-r1.md",
      "_tl-orc/project/evidence/benchmark-inputs/checkpoint-B/dev-report-6-0a.md",
      "_tl-orc/project/evidence/benchmark-inputs/checkpoint-B/manifest.json",
      "_tl-orc/project/evidence/benchmark-inputs/checkpoint-B/resume.json",
      "_tl-orc/project/evidence/benchmark-inputs/checkpoint-B/spec-6-0a.md"
    ],
    "allowed_support": [
      ".git",
      "/dev/null",
      "CHANGELOG.md",
      "README.md",
      "_tl-orc/PROJECT.md",
      "_tl-orc/project/STATUS.md",
      "docs",
      "prompts",
      "schemas",
      "scripts"
    ]
  },
  "telemetry_divergence": null,
  "pricing": {
    "basis": "official_task_proxy",
    "source": "docs/MODEL_ROUTING.md (proxy rubric)",
    "verified_at": "2026-09-11",
    "assumptions": [
      "Cache read priced at 10% of base input token price",
      "Cache creation priced at 1.25x of base input token price"
    ],
    "observed_tokens": 15037,
    "estimated_token_cost": 0.2252,
    "subscription_quota_impact": "unknown"
  },
  "rotation": {
    "rotation_recommended": false,
    "reason": "Session metrics within nominal bounds.",
    "applied_thresholds": {
      "max_turns": 30,
      "max_tool_bytes": 500000,
      "max_cache_tokens": 1000000
    }
  }
}
